Index,Id,dataset,InputText,ReferenceSummary,facebook/bart-large-cnn,google/pegasus-xsum,t5-large,gpt-3.5-turbo,RefSum
48,science-environment-44141840,xlsum,"By Helen BriggsBBC News In 2016, 1.9% of girls chose A-level physics, up from 1.6% in 2011. But that compared with 6.5% for boys in 2016 and 44% of schools in England still send no girls at all to study the subject. The IoP said physics-based skills were essential for many future careers, from artificial intelligence to aerospace. However, the gender balance at physics A-level in England's schools has changed little in decades, with only 20% being female. There is no evidence to suggest any intrinsic differences in ability or interest to explain why girls and boys choose technical subjects differently, said IoP President, Prof Dame Julia Higgins. The consequences of girls' choices at school are that many rewarding and fulfilling routes are closed off to them. Snapshot The report, Why Not Physics? - A Snapshot of Girls' Uptake at A-level, found only 1.9% of girls chose A-level physics in 2016, compared with 6.5% of boys. In 2011, 1.6% of girls chose the subject, compared with 6.1% of boys. In contrast, 8% of girls and 12.3% of boys progressed to maths A-level. In subjects such as English and psychology, the trend is reversed, with far more girls than boys choosing the subjects. The report makes a number of recommendations: The IoP is hosting a summit on Thursday to tackle gender inequality in the classroom and to debate new ways to close the gender gap in the take-up of physics A-level. An ill-judged quip that girls 'can't do maths', or 'physics is too hard', can lead to girls making life-changing decisions that alter the subjects they study or the career they pursue, said Prof Higgins in a foreword to the report. Women in physics are still in the minority, and this lack of visibility preserves the myth and cements the fact that physics is simply not a subject for girls. Skills gap The lack of girls studying physics to a higher level also had consequences for the UK economy, the report said. Physics-based skills are required in many growth areas, from aerospace to artificial intelligence, and thousands more workers need to be trained every year to keep the UK economy competitive. A recent study found that closing the gender gap in physics would take hundreds of years, given the current rate of progress. Research analysing the names of authors listed on millions of scientific papers found physics, computer science, maths and chemistry had the fewest women, while nursing and midwifery had the most. Without further interventions, the gender gap was likely to persist for generations, said scientists from the University of Melbourne. Forecasts suggest it will take a very long time to close the gender gap in some fields, with predictions of 320 years for nursing, 280 years for computer science, 258 years for physics and 60 years for mathematics. Follow Helen on Twitter.","Some progress has been made in encouraging girls to study physics at A-level, according to a report by the Institute of Physics (IoP).","In 2016, 1.9% of girls chose A-level physics, up from 1.6% in 2011. That compared with 6.5% for boys in 2016 and 44% of schools in England still send no girls at all to study the subject. The IoP said physics-based skills were essential for many future careers.","The gender gap in the number of girls studying physics A-level in England is unacceptable, says a report from the Institute of Physics (IoP). Women in physics are still in the minority, and this lack of visibility preserves the myth and cements the fact that physics is simply not a subject for girls. Skills gap The lack of girls studying physics to a higher level also had consequences for the UK economy, the report said.",IoP report: physics-based skills essential for many future careers. only 20% of girls choose the subject at physics A-level in England. physics-based skills are also required in many growth areas.,"Only 44% of schools in England send girls to study A-level physics and 20% of students in the subject are female, according to a report by the Institute of Physics, which has called for an end to the “myth and the fact” that the subject is not for women. In 2016, just 1.9% of girls opted for A-level physics, compared to 6.5% of boys. The gender balance has not changed significantly over the past few decades, despite the subject being necessary for possible careers in areas such as artificial intelligence and aerospace.","Some progress has been made in encouraging girls to study physics at A-level, according to a report by the Institute of Physics (IoP)."
49,science-environment-46582265,xlsum,"By Matt McGrathEnvironment correspondent, Katowice 1. The rules are key to the game However dull it may be, the operational rules for the 2015 Paris climate agreement will govern the way the world tackles climate change for decades to come. The key thing was not to unravel the carefully negotiated Paris agreement by having one set of rules for the rich countries and another one for the poor. By that measure the conference was a success with China showing leadership by not pushing for a return to the old ways of countries who did, and countries who didn't. Also helping that effort was the US. Ensuring that the China and the US face similar regulations has long been a key of American policy. Keeping everyone on the same page also delighted the EU. Climate commissioner Miguel Arias Canete explained how the new rules would work. We have a system of transparency, we have a system of reporting, we have rules to measure our emissions, we have a system to measure the impacts of our policies compared to what science recommends. To keep everyone in check, the rules will also contain a compliance mechanism, which means that countries that don't submit their reports on time will face an inquiry. The new regulations are flexible for developing countries, meaning they can sign up to the rules at a later date. 2. Science is worth fighting for One of the biggest rows at this meeting was over a key scientific report from the Intergovernmental Panel on Climate Change (IPCC). A group of countries including Saudi Arabia, US, Kuwait and Russia refused to welcome the IPCC study. They merely wanted to note the contents. Efforts to find a compromise ended in failure. However that was not the end of the matter. The vast majority of countries felt that acknowledging the science was critical at this conference. Their efforts did finally ensure that the IPCC was recognised - but many felt it was a token effort. That science is unsettling and it doesn't connect it to the need to do more, said Camilla Born from the environmental think tank E3G. The deal looks at it in isolation, it's an elegant compromise but it's not really enough. 3. International spirit is still alive Many countries had worried that with the rise of nationalism in many countries and the recent election of Jair Bolsonaro as Brazil's president, the international co-operation needed to tackle climate change might be in danger. For many getting agreement here in Katowice was less about technical rules and more about showing that the international spirit is still alive and has teeth. I think the beauty of multilateralism is that it is the effort of everybody, said Spanish Ecology Minister Teresa Ribera. And what we have seen is that everybody has supported the package, no single country has decided to step down. It is very difficult. It is like organising a party for 200 friends, and there's a single menu that everybody has to eat. It is not so easy but we have got it. That's fantastic! 4. A win for the process but not for the planet? While negotiators have been congratulating themselves on a job well done in landing the rulebook, there are many voices here who feel that the agreement does not go far enough. They point to the strength of the science, and the public recognition of the impacts of climate change seen this year in heatwaves and wildfires. How years compare with the 20th Century average 2019 10 warmest years 10 coldest years 20th Century average Hotter Colder Months Source: NOAA Many environmental campaigners believe that Katowice was a missed opportunity for radical action. We have ended up here with more of a coal trade fair than a climate convention, said Mohamed Adow from Christian Aid, referring to the efforts to promote coal by Poland and the US at this conference. We haven't acted in good faith, particularly for the young, that we takes seriously what science is telling us and we are responding to it. That message didn't come through. If people think the rulebook is the way to get the world on that path, it is not robust or ambitious enough. 5. New voices are emerging One of the most striking things about this conference of the parties was the presence of energised young people in far greater numbers than I have ever seen them at a COP before. Climate change chimes with young people in a way that is sometimes missing with older people, who make up the bulk of negotiators here. The sense that perhaps this UN process doesn't quite connect with the modern world was summed up best by Mohamed Nasheed, the former president of the Maldives and now their lead climate negotiator. Almost 10 years since I was last at these climate negotiations, I must say, nothing much seems to have changed. We are still using the same old, dinosaur language. Still saying the same old words. Still making the same tedious points. It would be hard to argue with this view given the shenanigans that played out at the end, when one country, Brazil, held up progress at the talks on one issue for a couple of days. Perhaps the most memorable image of this meeting was that of 15-year-old Swedish student Greta Thunberg. This teenager who has organised school strikes in Sweden held daily press conferences here to drive home her message that platitudes and warm words just aren't enough anymore. Her message was sharp and succinct. We cannot solve a crisis without treating it as a crisis.","Delegates to the UN climate conference in Poland have reached agreement on how to implement the 2015 Paris Climate Accord, which comes into force in 2020. What are the key points to come out of the meeting?","The operational rules for the 2015 Paris climate agreement will govern the way the world tackles climate change for decades to come. The key thing was not to unravel the carefully negotiated Paris agreement by having one set of rules for rich countries and another one for the poor. Many countries had worried that with the rise of nationalism in many countries, the international co-operation needed to tackle climate change might be in danger.","Here are three things we learned from this year's UN climate change conference in Katowice, Poland.",the rules for the 2015 Paris climate agreement will govern the way the world tackles climate change for decades to come. many countries feel that acknowledging the science was critical at this conference. environmental campaigners believe that the agreement does not go far enough.,"The United Nations climate summit held in Katowice, Poland has been seen by some environmental campaigners as a missed opportunity for what they see as necessary radical action. The climate agreement agreed by negotiators is seen as a positive step by others, with the Paris agreement's successful negotiation of regulations governing climate change seen as a key point. The meeting also highlighted the importance of science, with an argument over a report from the Intergovernmental Panel on Climate Change, and the vital role that international co-operation has in addressing climate change. Many young people were present at the conference, with Swedish student Greta Thunberg a powerful critic of what she sees as inadequate action.","Delegates to the UN climate conference in Poland have reached agreement on how to implement the 2015 Paris Climate Accord, which comes into force in 2020. What are the key points to come out of the meeting?"
50,science-environment-48786295,xlsum,"By Matt McGrathEnvironment correspondent, Bonn The chair of the Alliance of Small Island States said Saudi Arabia and others were trying to pretend a key scientific report didn't exist. Small island states believe keeping temperatures below 1.5C this century is critical to their survival. A key report in October said this was possible. But huge emissions cuts would be needed in the short term. The Intergovernmental Panel on Climate Change (IPCC) report on 1.5C was commissioned by the UN back in 2015. But when it was presented to climate negotiators in December in Poland, four countries including the US, Saudi Arabia, Russia and Kuwait refused to welcome it. The simmering battle over the report has re-emerged here at this meeting in Bonn. There has been a serious battle over a text that would include reference to the scientists' conclusion that carbon emissions would have to be reduced by 45% by 2030. Saudi Arabia has been at the fore in wanting to include text that underlined the uncertainties in the report. For the group of around 40 small island states, this has proved inflammatory. The report came out in in October of 2018 and now we see this move at the negotiations to try and have it almost erased from existence, which is impossible to do, Lois Young, the ambassador from Belize, who is chairing the group, told the BBC. There's this move to pretend as though it's not there, to not to refer to it in documents. And it's been ongoing since we got here. The Saudis have gained some support in their arguments from an unlikely alliance of countries, including the US, Australia and Iran. The countries that are trying to downplay the importance of the document, erase it from the records, not all of them are showing their faces, said Ambassador Young. It's unreal, it's as though they're resigning our Aosis states to collateral damage, I mean, it's like we have no importance doesn't matter. Other observers here believe that the IPCC report has been a critical document in helping raise public awareness of the threat posed by climate change. The report has had a transformational effect, not just with the UK now passing a net zero law, but with public opinion around the world, said Alden Meyer, from the Union of Concerned Scientists. But there is a fault line between a handful of countries, most of them major oil producers on the significance and status of the report. But they can't put the stopper back in the bottle and pretend the report doesn't exist. Efforts at finding a compromise are ongoing here in Bonn, with some delegates believing that both the goals for 2030 and the Saudi questions about uncertainty can be accommodated. These talks are due to finish later today but if an agreed text can't be found, the increasingly rancorous debate may spill into the open at the final meeting this afternoon. Follow Matt on Twitter.","Oil producing countries are trying to erase the science on keeping the world's temperatures below 1.5C, say some delegates at UN talks in Bonn.",Small island states believe keeping temperatures below 1.5C this century is critical to their survival. A key report in October said this was possible but huge emissions cuts would be needed in the short term. The simmering battle over the report has re-emerged here at this meeting in Bonn.,"A group of small island states has accused some of the world's biggest oil producers of trying to wipe out their concerns about climate change. It's unreal, it's as though they're resigning our Aosis states to collateral damage, I mean, it's like we have no importance doesn't matter. Other observers here believe that the IPCC report has been a critical document in helping raise public awareness of the threat posed by climate change.","the IPCC report on 1.5C was commissioned by the UN back in 2015. four countries including the us, Saudi Arabia, Russia and Kuwait refused to welcome it. the group of around 40 small island states believes keeping temperatures below 1.5C is critical.","Small island states have accused Saudi Arabia, Russia, the US and Kuwait of seeking to discount the findings of a key report from the Intergovernmental Panel on Climate Change (IPCC), presented at a meeting of the United Nations (UN) Convention on Climate Change in Bonn. The report said that the survival of many small island states depended upon keeping global warming within 1.5C by the end of the century. Achieving this would require significant cuts in emissions in the short term and reduced emissions of carbon, possibly by up to 45%, by 2030. Saudi Arabia has attempted to have reference to the IPCC report amended to reflect uncertainties.","Oil producing countries are trying to erase the science on keeping the world's temperatures below 1.5C, say some delegates at UN talks in Bonn."
51,science-environment-55769269,xlsum,"By Helen BriggsBBC Science correspondent The famous naturalist was haunted by the question of how the first flowering plants evolved. Darwin feared this inexplicable puzzle would undermine his theories of evolution, says Prof Richard Buggs. Forgotten historical documents show a rival scientist was arguing for divine intervention in the rise of the flowering plants. This greatly vexed Darwin in his final months, says the evolutionary biologist at Queen Mary, University of London. The mystery seems to have been made particularly abominable to him by its highly publicised use by the keeper of botany at the British Museum to argue for divine intervention in the history of life, he says. What is the abominable mystery? Darwin coined the phrase, abominable mystery, in 1879. In a letter to his closest friend, botanist and explorer Dr Joseph Hooker, he wrote: The rapid development as far as we can judge of all the higher plants within recent geological times is an abominable mystery. The mystery centres on the rise of the flowering plants, or angiosperms, the family of plants that produce flowers and bear their seeds in fruits. They make up the vast majority of all known living plants, from oaks to wildflowers and water lilies. Flowering plants appeared on Earth relatively recently on a geological timescale, then swiftly diversified in an explosion of colour, shape and form. In the fossil record they appear very suddenly in the Cretaceous, dated at about 100 million years ago, and there's nothing that looks like an angiosperm before them and then they suddenly appear and in considerable diversity, says Prof Buggs. Questions raised by the sudden appearance of flowering plants are at the heart of Darwin's abominable mystery, he explains. Why isn't there a gradual evolution of the angiosperms? Why can't we see intermediate forms between the gymnosperms - things like conifers - and the flowering plants? And why, when they appear, are they already so diverse? Why was Darwin puzzled? Darwin was deeply bothered by how flowering plants conquered the world seemingly in the blink of an eye, while other large groups, such as the mammals, evolved gradually. The advent of flowering plants suggested evolution could be both rapid and abrupt, in direct contradiction to an essential element of natural selection, natura non facit saltum - nature makes no leap. Darwin toyed with the idea that flowering plants might have evolved on an as yet undiscovered island or continent. In August 1881, only months before his death, he wrote to Hooker: Nothing is more extraordinary in the history of the Vegetable Kingdom, as it seems to me, than the apparently very sudden or abrupt development of the higher plants. I have sometimes speculated whether there did not exist somewhere during long ages an extremely isolated continent perhaps near the South Pole. What's the new thinking? In the library at the Royal Botanic Gardens, Kew, Prof Buggs came across a re-print of a lecture from 1876 by the Scottish botanist William Carruthers that gives new context to Darwin's thinking. William Carruthers rose to become keeper of botany at the British Museum, and a towering figure at the time in paleobotany. In a lecture to the Geologists Association in the library of University College London, Carruthers highlighted the problems that Darwin had with the fossil record, focussing on the sudden appearance of flowering plants. His comments were reported in The Times and the scientific press, sparking a public debate. Carruthers was using the abominable mystery to launch an attack on evolution itself, says Prof Buggs. He thought that God had created the angiosperms in the Cretaceous; they hadn't evolved. To Darwin and his friends, this was anathema, basically, because [Carruthers] was trying to bring supernatural explanations into the fossil record. But Darwin had a problem. The points Carruthers was making about the fossil record were actually very difficult to explain in terms of evolution, says Prof Buggs. He thinks this is what prompted Darwin to coin the phrase an abominable mystery and makes his case in a scientific paper, published in the American Journal of Botany. The mystery was to Darwin what Fermat's Last Theorem was to the 17th Century mathematician Pierre de Fermat, he adds. It gives an insight into what was going on in Darwin's mind in the last few years of his life and it gives it an extra romance, almost, a bit like Fermat's Last Theorem - Darwin's last mystery, this problem preying on his mind in his final months. And is the mystery solved? In short, no. One hundred and forty years later, the mystery's still unsolved, says Prof Buggs. Of course, we've made lots of progress in our understanding of evolution and in our knowledge of the fossil record, but this mystery is still there. Follow Helen on Twitter.",A scientist has shed new light on the origins of Charles Darwin's abominable mystery.,"Darwin coined the phrase, abominable mystery, in 1879. The mystery centres on the rise of the flowering plants, or angiosperms. Flowering plants appeared on Earth relatively recently on a geological timescale. The advent of flowering plants suggested evolution could be both rapid and abrupt.","Charles Darwin's abominable mystery about the origins of life was made particularly abominable to him by a rival scientist's argument for divine intervention, according to a new study.",abominable mystery centres on the rise of the flowering plants. flowering plants appeared relatively recently on a geological timescale. questions raised by the sudden appearance of flowering plants are at the heart of Darwin's abominable mystery.,"Scientists are still perplexed by the “abominable mystery” that haunted Charles Darwin — how and why did flowering plants come to be in such diversity and abundance so suddenly? The problem vexed him late in life, and remains unsolved. In the fossil record, flowering plants appeared in the early Cretaceous period around 100 million years ago, and in more than 300,000 species today they dominate every biome from frozen tundras to parched deserts. Unlike the evolution of mammals, there is no transition, but scientists have recently suggested that fungi may hold the key to the mystery.",A scientist has shed new light on the origins of Charles Darwin's abominable mystery.
