Index,Id,dataset,InputText,ReferenceSummary,facebook/bart-large-cnn,google/pegasus-xsum,t5-large,gpt-3.5-turbo,RefSum
93,uk-england-leicestershire-51356195,xlsum,"The journal, written in pencil by Pte Arthur Edward Diggins, describes the first day of the infamous World War One battle as something awful. The diary will be auctioned next month after being found among a box of military items in Leicestershire. Hansons Auctioneers said Pte Diggins survived the battle, which killed more than 20,000 British troops. The diary entry for 1 July 1916, the first day of the battle, reads: Something awful. Never witnessed anything like it before. After a bombardment of a week the Germans mounted their own trenches and the infantry reckon that every German had a machine gun. Five days later, Pte Diggins wrote: A shell drops just a few yards in front of our billet. We were all out except three of the boys. One was wounded. A good job I was not on my bit as a piece of shell buried itself in my candle. Oh, you lucky devil. The diary is due to be sold at a medals and militaria auction in Derbyshire on 20 March, with a guide price of £300 to £400. 'Delighted' Adrian Stevenson, from Hansons, said: The owner had no idea who any of the items related to but said his mother had been the recipient of old family heirlooms. It's a complete mystery how this Somme diary ended up in the Midlands, particularly as Arthur was born in London. The diary comes to an abrupt end in October 1916 and Hansons feared this was due to Pte Diggins dying. However, research found it was actually because he was sent a new diary to write in. Not only did he survive the First World War, he returned to his loved ones in England and became a husband and father, Mr Stevenson said. I'm always delighted when finds like this come in. They provide us with an opportunity to look back at important moments in history and celebrate the stories of long-forgotten servicemen. Follow BBC East Midlands on Facebook, Twitter, or Instagram. Send your story ideas to eastmidsnews@bbc.co.uk.",A diary detailing a soldier's experience in the Battle of the Somme has been discovered in a barn.,"Diary written by Pte Arthur Edward Diggins will be auctioned next month. It was found among a box of military items in Leicestershire. Pte Diggins survived the battle, which killed more than 20,000 British troops. The diary is due to be sold at a medals and militaria auction in Derbyshire.",A diary written by a soldier on the first day of the Battle of the Somme is expected to fetch up to £400 at auction.,journal written in pencil by pte Arthur Edward diggins will be auctioned next month. the diary is due to be sold at a medals and militaria auction in Derbyshire. research found it was because he was sent a new diary to write in.,"A diary, written in pencil by Pte Arthur Edward Diggins, describing the first day of the Battle of the Somme as something awful will be auctioned off next month by Hansons Auctioneers after being found in a box of military items in Leicestershire. The diary covers a period of trench warfare, and although Pte Diggins survived the battle, he does record that every German had a machine gun. The diary is expected to fetch between £300-£400.",A diary detailing a soldier's experience in the Battle of the Somme has been discovered in a barn.
94,uk-england-leicestershire-57039871,xlsum,"Rupert Matthews earned 135,566 votes, with Labour's Ross Willmott receiving 102,211. The incumbent Labour PCC Lord Willy Bach is stepping down following one term in the role, which was extended due to coronavirus, after being elected in 2016. Liberal Democrat candidate James Moore was eliminated in the first round. Mr Matthews, a former MEP for the East Midlands, said: I'm really looking forward to it. I am here to make the police force more effective, I am here to make our streets safer and I am here to make sure our police react more positively to the demands of the community. After the first round of voting, Mr Matthews was in the lead with 121,252 votes (49.27%), with Mr Willmott in second with 81,898 votes (33.28%). As neither candidate had received more than 50% of the votes, the lowest-polling candidate Mr Moore was eliminated and second preference ballots counted. This meant the ballots which picked the Liberal Democrat candidate as their first choice were checked for second preferences, and those choices were added to the two remaining candidates' totals. The turnout for the election was 30.2%, which was up from a 19.79% turnout at the last election in 2016. In Leicestershire County Council's elections on Thursday, the Conservatives retained control. A modern browser with JavaScript and a stable internet connection is required to view this interactive. Follow BBC East Midlands on Facebook, on Twitter, or on Instagram. Send your story ideas to eastmidsnews@bbc.co.uk. Related Internet Links Police and Crime Commissioner for Leicestershire",The Conservatives have won the election for the post of police and crime commissioner (PCC) for Leicestershire.,"Rupert Matthews earned 135,566 votes, with Labour's Ross Willmott receiving 102,211. The incumbent Labour PCC Lord Willy Bach is stepping down following one term. Liberal Democrat candidate James Moore was eliminated in the first round. The turnout for the election was 30.2%, up from a 19.79% turnout at the last election in 2016.",The Conservatives have won the race to be the next police and crime commissioner (PCC) for Leicestershire.,"the incumbent labour PCC Lord willy Bach is stepping down following one term. lib dem candidate James Moore was eliminated in the first round of voting. turnout for the election was 30.2%, up from a 19.79% turnout at the last election in 2016.","Conservative candidate Rupert Matthews has been elected as the new Police and Crime Commissioner for Leicestershire, defeating Labour candidate Ross Willmott. Matthews, a former MEP for the East Midlands, won 135,566 votes, whilst Willmott gained 102,211 votes. The Liberal Democrats' James Moore was eliminated in the first round of voting. The turnout for the election was 30.2%, an increase on the 19.79% turnout in 2016.",The Conservatives have won the election for the post of police and crime commissioner (PCC) for Leicestershire.
95,uk-england-lincolnshire-46126855,xlsum,"A white lorry and a silver Toyota Corolla collided on the B1391 at the junction with the A52 in Swineshead, near Boston, at about 06:30 GMT. A man in his 20s, who was in the car, later died from his injuries. The other people seriously hurt were also all in the Toyota. Police want to speak to the driver of a Transit van who may have witnessed it. Officers said the white or light coloured van had the numbers 07 on its back door and was not involved in the crash.",A man has died and four others have been seriously injured in a crash in Lincolnshire.,A lorry and a Toyota Corolla collided on the B1391 in Swineshead. A man in his 20s died from his injuries after the crash at about 06:30 GMT. Police want to speak to the driver of a Transit van who may have witnessed it.,A man has died and four people have been seriously injured in a crash between a lorry and a car in Lincolnshire.,"a white lorry and a silver Toyota collided on the B1391 in Swineshead. a man in his 20s, who was in the car, later died from his injuries. the other people seriously hurt were all in the Toyota.","A man in his 20s died and several others were seriously injured in a car and lorry collision in Swineshead, near Boston. Police are seeking the driver of a Transit van who may have witnessed the incident. The van, which had the numbers 07 on its back door, was not involved in the crash.",A man has died and four others have been seriously injured in a crash in Lincolnshire.
96,uk-england-lincolnshire-46566950,xlsum,"Officers seized 76 dogs during the 2017-18 season, which runs from September until March, as part of operations to disrupt the activity. The idea for fostering dogs initially involved members of the public but the force said it now wanted to trial the scheme with staff first. Dogs are currently looked after in kennels pending any court action. Wildlife officers reported a 30% reduction in the number of hare coursing incidents since the tactic of seizing animals was introduced in 2017. Police said it was effective because coursers can often be engaged in illegal betting activities and the dogs involved can be worth thousands of pounds. However, Supt Phil Vickers said there was a financial impact on the force in paying for the animals to be housed in kennels. It is hoped the fostering scheme will help to reduce costs. Lincolnshire's Police and Crime Commissioner Marc Jones said seizing dogs was a vital part in ridding the county of the problem - but cost the force approximately £45,000 in 2018. Mr Jones said he was working to get a change in the law so costs could be passed to the dog's owners. In January dogs which had been used in illegal hare coursing were for the first time rehomed rather than being returned to their owners. Hare coursing Source: Lincolnshire Police",Dogs seized in hare coursing operations could be fostered by staff at Lincolnshire Police.,"Officers seized 76 dogs during the 2017-18 season, which runs from September until March. Wildlife officers reported a 30% reduction in the number of hare coursing incidents since the tactic of seizing animals was introduced in 2017. Lincolnshire's Police and Crime Commissioner Marc Jones said seizing dogs was a vital part in ridding the county of the problem.",A scheme to rehome dogs seized in the fight against illegal hare coursing in Lincolnshire is to be trialled by the force.,"officers seized 76 dogs during the 2017-18 season, which runs from September to march, as part of operations to disrupt the activity. the idea for fostering dogs initially involved members of the public but the force said it now wanted to trial the scheme with staff first.","Lincolnshire police is considering fostering seized dogs used in illegal hare coursing cases, as opposed to housing them in kennels. During the 2017-18 season, which ran from September to March, the force seized 76 dogs in an attempt to disrupt illegal activity. The fostering scheme would aim to cut costs, as the kennelling and care of seized dogs cost the force approximately £45,000 ($58,000). Seized dogs can previously be worth thousands of pounds and are frequently used for illegal betting.",Dogs seized in hare coursing operations could be fostered by staff at Lincolnshire Police.
97,uk-england-london-19691122,xlsum,"Last month, Liberal Democrat MP Simon Hughes said that inner London second homes were are a serious problem and were pushing up house prices. The MP for Bermondsey and Old Southwark wants councils to have powers to make certain properties off limits. But only Lewisham Council has expressed an interest in using the powers. 'It is madness' And senior Conservative sources said there was little to no chance it would ever become coalition policy. A Southwark Council spokesman said: How do you go about policing it? What about the foreign investor, or someone who uses a front man? How are people going to be prosecuted? He added: It is madness. Research by the Smith Institute has suggested that last year 60% of new build properties in central London were purchased by foreign buyers, who spent about £5bn. That is equivalent to the government's affordable housing budget for all of England for four years. Mr Hughes's proposal is set to be discussed later during the Lib Dem conference.",Only one out of the 12 inner London councils have said they would support a proposal to ban people from buying second homes.,Lib Dem MP Simon Hughes wants councils to have powers to make certain properties off limits. But only Lewisham Council has expressed an interest in using the powers. Senior Conservative sources say there is little to no chance it would ever become coalition policy. Research suggests that last year 60% of new build properties in central London were purchased by foreign buyers.,A proposal to ban foreign investors from buying second homes in London has been dismissed as madness by a council.,lib dems want councils to have powers to make certain properties off limits. only Lewisham council has expressed an interest in using the powers. senior conservative sources said there was little to no chance it would become coalition policy.,"Liberal Democrat MP Simon Hughes proposed making inner London second homes off limits to help combat rising house prices, however, senior Conservative sources have said that it is unlikely to ever become coalition policy. Only Lewisham Council has expressed an interest in using the powers, with Southwark Council stating that it would be difficult to police and could be madness. Research has shown that 60% of new build properties in central London were purchased by foreign buyers in 2019, equating to around £5bn spent.",Only one out of the 12 inner London councils have said they would support a proposal to ban people from buying second homes.
98,uk-england-london-28177979,xlsum,"Passengers will need a prepaid or concessionary ticket, Oyster card or a contactless payment card to travel. TfL said only 0.7% of all bus journeys were paid for with cash and that tourists were unlikely to be affected. But the Green Party said more ticket outlets were needed and questioned how vulnerable passengers would cope. TfL said its research showed the move, which came into force at 04:30 BST, was unlikely to affect tourists as the vast majority use a prepaid ticket, such as a Visitor Oyster, to get around the capital. 'Highly inadequate' Its drivers have been asked to guide vulnerable people. Last month TfL introduced the one more journey feature for Oyster users, allowing passengers to make one further trip if they have insufficient credit on their card, which TfL said had benefitted around 44,000 customers a day. Mike Weston, TfL's director of buses, said: Removing cash from our bus network not only offers customers a quicker and more efficient bus service but it enables us to make savings of £24m a year which will be re-invested to further improve London's transport network. But Green Party London Assembly member Darren Johnson said questions remained over whether passengers who lost or damaged their Oyster cards would be allowed to travel at all, saying that more than 2,100 Oyster cards were lost, stolen or stopped working on the average day last year. Mr Johnson said: I am very concerned that TfL are only planning 19 new Oyster ticket stops in preparation for the cashless switchover. This seems highly inadequate, especially when every ticket office across the tube network is going to be closed. I also have serious concerns about the impact which this sweeping change could have on vulnerable passengers.",Cash can no longer be used on any of London's buses in a move that Transport for London (TfL) says will save £24m a year.,"TfL said only 0.7% of all bus journeys were paid for with cash. Green Party said more ticket outlets were needed and questioned how vulnerable passengers would cope. It said more than 2,100 Oyster cards were lost, stolen or stopped working on the average day last year.","Cash will no longer be accepted on London's buses from Monday, Transport for London (TfL) has announced. Mike Weston, TfL's director of buses, said: Removing cash from our bus network not only offers customers a quicker and more efficient bus service but it enables us to make savings of £24m a year which will be re-invested to further improve London's transport network. But Green Party London Assembly member Darren Johnson said questions remained over whether passengers who lost",TfL said only 0.7% of all bus journeys were paid for with cash. the cashless switchover came into force at 04:30 BST. the green party said more ticket outlets were needed.,"From today, passengers in London will no longer be able to pay for bus journeys with cash. Transport for London (TfL) has said that only 0.7% of bus journeys are paid for with cash and that tourists are unlikely to be affected. Passengers will need a prepaid or concessionary ticket, Oyster card or a contactless payment card to travel. The move will save TfL £24m a year, money which will be invested in improving the transport network. However, Green Party London Assembly member, Darren Johnson, has said that more Oyster outlets and ticket stops are needed and that the impact on vulnerable passengers has yet to be determined. ",Cash can no longer be used on any of London's buses in a move that Transport for London (TfL) says will save £24m a year.
99,uk-england-london-46741638,xlsum,"Tudor Simionov was working at Fountain House on Park Lane when he was attacked at about 05:30 GMT. The Met said the Romanian national, who lived in Ilford, was attacked by a group of men who had tried to enter the party. A 26-year-old man is in custody at a central London police station. Two other security staff and a 29-year-old woman were also stabbed in the attack. They suffered significant injuries but these are not thought to be life-threatening. Det Ch Insp Andy Partridge described it as a shocking attack and called for witnesses to come forward and assist the investigation. A woman who was killed in a separate stabbing early on 1 January was named by police earlier. Mother-of-one Charlotte Huggins was found fatally wounded at a home on John Ruskin Street, Camberwell, at 04:20 GMT on Tuesday. A post-mortem examination gave her cause of death as a single stab wound. A 34-year-old man initially arrested on suspicion of attempted murder has been released on bail until mid-January, the police said. Related Internet Links Metropolitan Police",A man has been arrested on suspicion of murdering a security guard who was stabbed to death at a private party in London's West End on New Year's Day.,"Tudor Simionov was working at Fountain House on Park Lane when he was attacked. The Romanian national, who lived in Ilford, was attacked by a group of men who had tried to enter the party. A 26-year-old man is in custody at a central London police station.","A man has been arrested on suspicion of murder after a security guard was stabbed to death outside a New Year's Eve party in east London. A 34-year-old man initially arrested on suspicion of attempted murder has been released on bail until mid-January, the police said.",a 26-year-old man is in custody at a central london police station. two other security staff and a 29-year-old woman were also stabbed. a woman who was killed in a separate stabbing was named by police.,"Security guard Tudor Simionov was stabbed to death while working at Fountain House on Park Lane in London. A group of men tried to enter a party that Simionov was guarding, leading to the attack. Two other security staff and a woman were also injured but their injuries are not thought to be life-threatening. A suspect is in custody, but witnesses are being called upon to provide assistance to the investigation. An unrelated stabbing earlier that day in Camberwell resulted in the death of Charlotte Huggins. A man initially arrested for attempted murder in connection with her death has been bailed until mid-January.",A man has been arrested on suspicion of murdering a security guard who was stabbed to death at a private party in London's West End on New Year's Day.
100,uk-england-merseyside-44696813,xlsum,"Cheshire Police said the woman's arrest was a significant step forward in an investigation into deaths at the Countess of Chester Hospital. Officers have been investigating the deaths of 17 newborns at the neonatal unit between March 2015 and July 2016. A spokesman said the probe also covered 15 non-fatal collapses. The cases being investigated involve families from the Cheshire and north Wales area. The Countess of Chester declined to comment on whether any staff had been suspended and Cheshire Police would not reveal the role of the healthcare professional within the hospital. Police have confirmed they are searching a property in Westbourne Road, Chester, about a mile from the hospital, in connection with the investigation. Neighbours said a woman lived at the house and had moved in about two years ago. Det Insp Paul Hughes said the investigation was highly complex and very sensitive and officers were doing everything we possibly can to try to establish in detail what has led to these baby deaths and collapses. He said there were no set timescales for this coming to a conclusion but we remain committed to carrying out a thorough investigation as soon as possible. Parents of all the babies are continuing to be kept fully updated and are being supported. This is an extremely difficult time and it is important to remember that there are bereaved families seeking answers as to what happened to their children. Police were asked to investigate the deaths of eight babies in May 2017, a probe which has since widened to include nine more. Analysis: By Daniel Wainwright, BBC England data unit In 2017 the Countess of Chester was among 21 hospitals called upon to investigate higher than average death rates. Authors of the MBRRACE-UK (Mothers and Babies: Reducing Risk through Audits and Confidential Enquiries across the UK) report looked at stillbirths and neonatal deaths around the UK in 2015. They found the Countess of Chester Hospital NHS Foundation Trust had a neonatal death rate of 1.91 for every 1,000 live births that year. This was the highest out of the 43 trusts of a similar size it was compared with, which had an average of 1.27 neonatal deaths for every 1,000 live births. There were also 5.42 extended perinatal deaths - deaths within four weeks - for every 1,000 births, including stillbirths. The average for similar sized maternity units was 4.73 deaths per 1,000 births. The rate declined in 2016 but was still among the highest in the group. Hospital medical director Ian Harvey said asking police to investigate the deaths had not been something we did lightly, but we need to do everything we can to understand what has happened. He added the neonatal unit was safe to continue in its current form and remained open to women over 32 weeks in their pregnancy. The unit has 13 cots providing specialist care for about 400 newborn and premature babies born at 32 weeks and above each year. It stopped providing care for those born earlier than 32 weeks in July 2016 after the hospital reported a greater number of baby deaths and collapses than normally expected. A review by the Royal College of Paediatrics and Child Health the following February said no definitive explanation had been found for the increase in mortality rates at the neonatal unit and there were no obvious factors linking the deaths. An inspection of the hospital by the Care Quality Commission in 2016 found the unit's nursing staff levels did not meet standards recommended by the British Association of Perinatal Medicine and it lacked storage space and resources for effective infection control.",A healthcare professional has been arrested on suspicion of murdering eight babies and attempting to kill six others at a hospital.,"Cheshire Police are investigating the deaths of 17 newborns at the hospital. Officers are also investigating 15 non-fatal collapses at the neonatal unit. The cases involve families from the Cheshire and north Wales area. Police are searching a property in Westbourne Road, Chester, in connection with the investigation.",A healthcare professional has been arrested on suspicion of manslaughter by gross negligence over the deaths of 17 babies at a hospital.,police investigating deaths of 17 newborns at Countess of Chester hospital. probe also covering 15 non-fatal collapses involving families from the area. Countess of Chester declined to comment on whether any staff had been suspended.,"A healthcare professional has been arrested on suspicion of murdering eight babies and attempting to murder six others at the Countess of Chester Hospital's neonatal unit. The arrest was described as a significant step forward by Cheshire Police, who have been investigating the deaths of 17 infants and non-fatal collapses of 15 others between 2015 and 2016. The case involves families from north Wales and Cheshire and is seen as highly complex and very sensitive. The hospital was one of 21 such facilities in the UK asked to investigate above average death rates last year. ",A healthcare professional has been arrested on suspicion of murdering eight babies and attempting to kill six others at a hospital.
