Index,Id,dataset,InputText,ReferenceSummary,facebook/bart-large-cnn,google/pegasus-xsum,t5-large,gpt-3.5-turbo,RefSum
151,uk-wales-33793177,xlsum,"Nearly 79% of premises in Wales are capable of receiving super-fast internet, an increase of 24% on 2014. The take-up is 77% - 6% higher than in Scotland and 8% above Northern Ireland. Rhodri Williams, Ofcom director for Wales, said public funding to roll out the Superfast Cymru programme across Wales had transformed the picture. Things have improved due to the substantial amount of public investment that has taken place, he said, with financial backing coming from the EU, the UK and Welsh governments. But other findings in the report showed that Wales had the lowest availability of 4G services across the UK, with just under a quarter (23%) of adults having a 4G service in May 2015. Deputy minister for skills and technology Julie James welcomed the report and added: Fast and reliable internet connections are vital. The findings are part of Ofcom's 10th annual review of the communications market in Wales. Television The report showed people in Wales are the television addicts of the UK. On average they spend four hours 11 minutes watching TV a day - more than anywhere else in the UK. Despite people in Wales continuing to watch significantly more television than those in the UK as a whole, the average time they spent watching broadcast television declined by 12 minutes in 2014. And the report found the Welsh had more pay TV than anywhere else in the UK with seven in 10 households buying extra channels. The BBC's television services continue to perform better in Wales than in any other nation for reach, share, viewing hours and viewer appreciation scores. Internet and social media More than one in five Welsh adults said they were hooked on social media. Six in 10 adults in Wales have a tablet computer in the household compared to less than half (45%) last year. But internet users in Wales cited the laptop as their most important device for going online. Most internet users in Wales said they spend around 21.2 hours online per week with more than half of all Welsh internet users spending time on social networking sites on a weekly basis. The use of Twitter was higher among online adults in Wales (48%) than England (40%), Scotland (32%) and Northern Ireland (33%). More than eight in 10 online adults in Wales said they have used Facebook. Radio People in Wales consume more radio than the UK as a whole - and they listen for longer. In 2014, radio services reached 94.5% of the adult population in Wales. Wales continued to have the highest share (59%) of listening to BBC services and the lowest share of listening to local commercial radio (26%). Close to half of adults in Wales (47%) who listen to radio have a digital radio set.","Wales has the highest take-up of broadband of any of the devolved nations, according to a report from the watchdog Ofcom.",Nearly 79% of premises in Wales are capable of receiving super-fast internet. The take-up is 6% higher than in Scotland and 8% above Northern Ireland. Wales had the lowest availability of 4G services across the UK. More than one in five Welsh adults said they were hooked on social media.,"Wales has the highest take-up of high-speed internet in the UK, according to a report by communications regulator Ofcom.",nearly 79% of premises in Wales are capable of receiving super-fast internet. take-up is 77% - 6% higher than in Scotland and 8% above northern Ireland. just under a quarter (23%) of adults in Wales had a 4G service in May 2015.,"Ofcom, the UK telecom regulator, released a report yesterday entitled the Communications Market Report for Wales stating that almost 79% of Wales is now able to get super-fast internet, a rise of 24% over 2014. The take-up stands at 77%, which is 6% higher than Scotland and 8% above Northern Ireland. However, Wales has the lowest availability of 4G services across the UK, with 23% of adults having a 4G service as of May 2015. The study also found that those in Wales spend more time watching television than anywhere else in the UK, clocking up an average of four hours 11 minutes a day; furthermore, discussions with less than half of the general Welsh adult population about their online activities found that the Welsh are the most dedicated social media users in the UK, with just over one in five adults saying they are hooked on social networking sites. ","Wales has the highest take-up of broadband of any of the devolved nations, according to a report from the watchdog Ofcom."
152,uk-wales-52063785,xlsum,"Supermarkets have access to a UK government database of 1.5m vulnerable shoppers in England. Philip Pearce from Bridgend said he was vulnerable and it was ridiculous he could not sign up. The Welsh Government said it was urgently working to resolve the issue. Mr Pearce said: I tried to shop at Sainsbury's this morning and because I am classified as vulnerable, I thought I'd be able to register quite easily. I went onto the UK government's web page but found I couldn't sign up because I live in Wales. It's ridiculous. How am I meant to get my shopping delivered now? I have always had it delivered but now I'm expected to pick it up. This can't be right. Age Cymru said it was vital for people in Wales to be able to sign up. Its chief executive Victoria Lloyd said: Many older people have told us that they have to wait for up to three weeks for a delivery while others were simply thrown out of the registration process. Systems must be put in place to enable the supermarkets to verify who exactly needs to be given priority in Wales. We have contacted the Welsh Government about the issue and we'll be urging the appropriate authorities in Wales to work with the retail sector to make sure vulnerable people are not worried about how they will feed themselves over the coming weeks. John Evans, who lives in Llanharry, Rhondda Cynon Taff, cares for his disabled wife and has family members who are asthmatic. He says he also went on the Sainsbury's website to register as vulnerable but it directed him to the UK government page which asked if he was living in England. It's ridiculous and frustrating and I'm not the kind of person who isn't familiar with being online, he said. Retired nurse Beverly Harrison-Wood, 63, from Cardigan, Ceredigion, told BBC Wales the earliest delivery slot she has been offered with any of the major supermarkets was mid-April. Mrs Harrison-Wood, who has rheumatoid arthritis, lives with her husband, 69, and her 85-year-old mother, said they had about a week's worth of food left. She said: There's no chance at all of getting a delivery... Unfortunately we can't [sign up for priority] as it's available to England but not to Wales, which is annoying. 'Working hard' She said some small local shops were now doing deliveries: They are trying their hardest, but we don't shop there and we don't know what they sell. Sainsbury's has said it is doing its absolute best to make online delivery slots available to vulnerable customers. In an email to shoppers, chief executive Mike Coupe said: We are also working hard to secure detail for vulnerable people living in Wales, Scotland and Northern Ireland. The retailer told BBC Wales said it had proactively contacted 270,000 customers across the UK, including Wales, who had already given us information that meant we could identify them as elderly or vulnerable. An Asda spokesperson said: We ask that any customer who has specific circumstance due to coronavirus lets us know in the 'other information' section whilst placing their order. BBC Wales understands Tesco is examining how it can best make such deliveries to all parts of the UK. A Welsh Government spokesman said: We are working with retailers, through the Covid-19 retailers forum and retailer associations, to resolve this issue as a matter of urgency. People with certain long-term health conditions are being advised to stay at home and adopt a series of 'shielding' measures for at least 12 weeks. They will receive a letter setting out the steps they need to take. We will make sure this group of people can get food, medicines and other essentials. For those who cannot turn to family, friends and local support networks, we are working closely with the Welsh Local Government Association and the Wales Council for Voluntary Action to ensure support is available locally.",People forced to self-isolate have expressed frustration at not being included in a programme to help prioritise food deliveries for those unable to leave the house.,Supermarkets have access to a UK government database of 1.5m vulnerable shoppers. Philip Pearce from Bridgend said he was vulnerable and it was ridiculous he could not sign up. Welsh Government said it was urgently working to resolve the issue. Sainsbury's said it is doing its absolute best to make online delivery slots available.,Elderly and vulnerable people in Wales have said they have been unable to sign up for supermarket delivery services because they live in England.,supermarkets have access to a uk government database of 1.5m vulnerable shoppers. ridiculous that vulnerable shoppers cannot sign up because they live in the uk. the Welsh Government said it was urgently working to resolve the issue.,"Supermarkets have access to a database of 1.5 million vulnerable shoppers in England, but some Welsh residents have been unable to sign up for priority deliveries due to the UK government's website asking if they live in England. Age Cymru called for systems enabling supermarkets to verify vulnerable Welsh shoppers to be put in place. Sainsbury's said it is trying to make online deliveries available to the vulnerable, and it has proactively contacted 270,000 elderly or vulnerable customers across the UK. Meanwhile, Asda said customers should flag specific circumstances in delivery information, and Tesco is examining ways of making deliveries across the UK.",People forced to self-isolate have expressed frustration at not being included in a programme to help prioritise food deliveries for those unable to leave the house.
153,uk-wales-56165569,xlsum,"By Natalie GriceBBC News Dr Chris Jones, deputy chief medical officer, said there was a real risk of a third wave of Covid-19 cases if restrictions eased too quickly. He was speaking after Prime Minister Boris Johnson unveiled a plan to end lockdown in England, by 21 June. The Conservatives have called for the Welsh Government to produce a roadmap for the end of the Covid lockdown. Speaking to BBC Radio Wales Breakfast, Dr Jones said there were probably greater risks now than at previous points in the pandemic because of the more transmissible variants. He told Claire Summers that opening schools has a definite effect on the R-rate, and how the new variants will affect infections is uncertain. It is absolutely impossible in my view to say that on any one date in several months, that this will be the situation, he said in response to a question about Mr Johnson's announcement. I think we have to take things step by step. He said all the UK's chief medical officers share the same view about the risks associated with relaxing restrictions, but added politicians had very difficult decisions to make. But he said messaging to the public was very important. To send the message that everything is going to be back to normal in a few months time, I think, is almost too open, he said. We are not out of the woods yet. There is a real risk of a third wave if restrictions are eased too quickly. We hope, from our cautious approach and step-by-step approach, will minimise the risk of that. How does Wales compare to England? In England, the prime minister has set out a four-stage plan beginning on 8 March, with at least five weeks between each of the stages to allow time to assess the impact of relaxing some restrictions to be felt, and prepare for the next stage if possible. Scotland's First Minister Nicola Sturgeon has published a cautious framework to ending restrictions there, with the reopening of shops, bars, restaurants, gyms and hairdressers expected to start from 26 April. She said it was hoped that Scotland's stay at home restrictions could be lifted on 5 April. However, Northern Ireland has renewed lockdown measures until 1 April. When do schools return? Children in England are due to return to the classroom on 8 March. In Wales, Foundation phase children, aged three to seven, are returning to school this week. If conditions regarding the virus continue to improve, all primary years will be back in school on 15 March, along with pupils in exam years 11 and 13, and some pupils in years 10 and 12 who are due to sit exams. However, Education Minister Kirsty Williams said not all of those secondary-age pupils would be back in full time, which she hopes will happen from 12 April. In Scotland all primary pupils and S4 to S6 secondary students could return to school from 15 March, but pupils in the first three years of secondary school are unlikely to return until after Easter. Can I visit my relative in a care home? From 8 March in England, one nominated person will be able to visit a care home resident, but there is no date for this in Wales, where care home visits remain banned. Care Forum Wales is working with the Welsh Government to formulate a safe policy for visiting. Someone who is very keen to see visits start is Jen Sutton. Her mother Liz Jones is 82 and lives in a care home in Aberystwyth. Ms Sutton, who lives in Cardiff, is an only child and used to visit her mother regularly until the pandemic struck. I haven't seen her indoors since March and the only other visit I've had is 20 minutes in a garden pod end of July, beginning of August. Then they closed down again for various reasons. I've seen her on Skype but it's not the same, she said. I'd just like to see her through a window. If it meant me isolating for 10 days beforehand I would do that. I don't particularly want to go in. I'm quite happy to wave through a window. It's a human right isn't it, to see your family. It's not too much to ask. When will shops reopen? This is one of the areas where Wales could be moving more quickly than England. On Friday, First Minister Mark Drakeford said some non-essential shops and hairdressers could reopen on 15 March. But this has raised questions over prioritising this when large numbers of secondary pupils will remain unable to return to the classroom. England is due to reopen all shops on 12 April, while in Scotland the provisional date is 26 April. Who can I meet? For most of us the rules for who we can meet indoors remain limited to the people we live with. Until 27 February, only those who lived alone - or are single and live in a house share - and single parents had been able to form a so-called support bubble. However, now families with babies are now allowed to meet up with one other household to form a bubble. It means anyone with a child under the age of one can form an exclusive support bubble with another household, allowing them to meet indoors, and stay overnight in each others homes. The rule change also allows teenagers - aged 16 to 17 - who do not live with an adult to form a support bubble with another household. Who can I see outside the home? Since Saturday 20 February , people in Wales have been able to exercise in groups of four, but only from a maximum of two households, and it must be exercise rather than socialising, Mr Drakeford said. In England, from 8 March people can exercise with one other person not from their household, but they will also be allowed to meet outdoors on a park bench for a chat, for example, expressly for the purpose of socialising. In Scotland a provisional date of 15 March has been given for four people from two households to be allowed to meet outdoors. Then from 29 March, people in England will be able to meet in groups of up to six people from different households, or two groups from two households. They will be able to do this in private gardens as well as public spaces. What about having a holiday? Discussions have been ongoing in Wales with the tourism sector about a potential reopening at Easter. The country is again likely to be ahead of England on this, although no firm date has been mentioned yet, and Mr Drakeford said it would not be opened in one go. Mr Johnson's roadmap has holidays in self-contained accommodation used by one household being allowed from 12 April at the earliest, which misses the school holidays completely. How long do we have to stay at home? Mr Drakeford has talked of easing the stay at home requirement at the lockdown review on 12 March, if cases continue to decreased. However he has said there could be a stay local requirement in place, as there was in the arrangements during the autumn for people to remain in their local authority area. Mr Johnson has said the stay at home rule in England will end on 29 March but people should stay as local as possible, while in Scotland, Nicola Sturgeon has said she hopes stay at home restrictions could be lifted on 5 April. What about sport? At present, only certain elite athletes in Wales are allowed to train together. No dates have been mooted so far to allow people to get together for sport, including more individual distanced pursuits like golf or singles' tennis. There are also no plans to reopen gyms. In England, outdoor sports venues and formally organised outdoor sports can resume from 29 March. Gyms will be able to open from 12 April at the earliest. While in Scotland the possible date for reopening gyms and swimming pools has been mooted as 26 April. Can I get married or form a civil partnership? Currently in Wales, only register offices and places of worship are open to perform marriages and guests are limited to the number who can be accommodated in the venue under the 2m social distancing regulations for different households. From 1 March, licensed wedding venues will be able to reopen for ceremonies. In England, six people can currently attend but ceremonies are limited to those in exceptional circumstances, such as those who are terminally ill. From 8 March, all weddings with six people will be allowed. This will expand to 15 people on 12 April and 30 people on 17 May. Can I get a pint at the pub? Not any time soon in Wales, in a nutshell. There has been no date mooted, and Mr Drakeford said closures were unlikely to be revoked in the next six weeks. In England, it is hoped people will be able to visit outdoor seating in restaurants and pubs from 12 April, and move indoors from 17 May. Meanwhile in Scotland pubs could reopen on 26 April.","It is impossible to give a date for the end of lockdown restrictions, one of Wales' top doctors says.",Deputy chief medical officer Dr Chris Jones said there were probably greater risks now than at previous points in the pandemic. He said opening schools has a definite effect on the R-rate and how the new variants will affect infections is uncertain The Conservatives have called for the Welsh Government to produce a roadmap for the end of the Covid lockdown.,"It is impossible to predict when the swine flu lockdown in Wales will be lifted, the Welsh Government's top doctor has said.","there is a real risk of a third wave if restrictions are eased too quickly, says dr Chris Jones. he says opening schools has a definite effect on the R-rate in england. messaging to the public is very important, says dr Jones.","Dr Chris Jones, deputy chief medical officer, has warned that there is a real risk of a third wave of Covid-19 cases if restrictions in England are eased too quickly. His comments follow Prime Minister Boris Johnson's plan to end lockdown in England by 21 June. Dr Jones told BBC Radio Wales Breakfast that opening schools has a definite effect on the R-rate, and how the new variants will affect infections is uncertain. England has a four-stage plan beginning on 8 March, while Scotland has published a cautious framework to ending restrictions there, and Northern Ireland has renewed lockdown measures until 1 April.","It is impossible to give a date for the end of lockdown restrictions, one of Wales' top doctors says."
154,uk-wales-north-east-wales-14339132,xlsum,"It is understood 115 people ranging from catering staff to the coaches and players have not been paid. A supporters group is appealing to fans to make donations to an emergency fund to pay the players. Mr Moss also said he was considering leaving the country because of death threats which he said have been made against him. He said the club, which is up for sale, was desperately searching for cash to pay both the wages and a £45,000 tax bill. Two pre-season friendlies have been cancelled. Wrexham Supporters Trust have been involved in a lengthy bid to buy the club. It said it still hoped a deal could be concluded. The Wrexham Supporters Federation, an umbrella organisation for all independent supporters groups, has set-up the fund to raise money for the players. The club shares the same owners and Racecourse home as the Crusaders, whose withdrawal from Super League was announced on Tuesday. Crusaders players have been paid. In a statement issued to the Daily Post, Mr Moss said: We had mistakenly hoped a deal would have been concluded by now which would have resolved the situation. This has left us in a very difficult financial situation which we have highlighted several times recently. It is very regrettable - we have run out of money, it's not that we won't [pay the players], we just can't. He said he had lost a lot of money and was in a difficult financial situation that would mean he would have to sell his house. I am afraid that for the sake of my family's safety in view of the death threats I have received, I may have to leave the country, he added. Stay calm Wrexham Village, the holding company which owns Wrexham FC, also owns the Racecourse ground and the club's training facility. Glyndwr University is discussing plans which could see it buy into the Racecourse with the Supporters Trust buying the football club. Trust spokesman Spencer Harris said their bid hinged on the backing of third parties. He said: The situation as it is that we have agreed a deal in principle on taking over the club. That deal involves third parties. As soon as the third parties are ready, the deal can go through. I'm confident that if we all keep level heads and stay calm in this situation and Geoff Moss keeps the club going while the deal is completed, then Wrexham FC has a very bright future. Mr Harris said the the trust's constitution prevented it stepping in with emergency funding to keep the club running before a deal was sealed. The Supporters Federation is appealing for fans to help pay the players' wages. It said it was fully behind the trust's bid to buy the club and understood the trust could not use its money to pay them. This emergency fund will help for the interim period between the club being taken over by the trust and the ground by the university, it said. Games at Colwyn Bay on Thursday night and at Vauxhall Motors on Saturday have been cancelled. Wrexham's 2011-12 Blue Square Bet Premier campaign is due to get underway at the Racecourse against Cambridge on Saturday, 13 August. Former Wrexham manager and player Dixie McNeil said he was worried what it would mean for the coming season. He told BBC Radio Wales: All I can see is the Conference or the Football League stepping in at some stage and saying 'hang on a minute, are you able to get through next season?' At the moment, you look at the statement that's been made, and you say 'I don't think so.'",Wrexham FC's co-owner Geoff Moss has said the football club has run out of money.,Wrexham Supporters Trust have been involved in a lengthy bid to buy the club. It is understood 115 people ranging from catering staff to the coaches and players have not been paid. Two pre-season friendlies have been cancelled. Club shares the same owners and Racecourse home as the Crusaders.,"Wrexham FC has run out of money and is in a very difficult financial situation, the club's chairman Geoff Moss has said. I'm confident that if we all keep level heads and stay calm in this situation and Geoff Moss keeps the club going while the deal is completed, then Wrexham FC has a very bright future.",115 people ranging from catering staff to the coaches and players have not been paid. wrexham supporters trust have been involved in a lengthy bid to buy the club. club shares the same owners and Racecourse home as the crusaders.,"Wrexham Football Club based in North Wales has advised its players, as well as catering staff and coaches, that it cannot pay their wages due to cashflow issues. The club is currently searching for funding to pay £45k in tax. Two pre-season friendlies have already been cancelled. A supporter group is calling on fans to make donations to an emergency fund to pay the players. Owner, Geoff Moss, is considering leaving the country due to death threats he says he has received. The struggling club shares the same owners as the rugby team Crusaders, whose withdrawal from Super League was announced earlier this week.  ",Wrexham FC's co-owner Geoff Moss has said the football club has run out of money.
